id,comment,like,timestamp
mina81818,想請問蛋白跟蛋黃分開打入是會比較漂亮還是什麼原因呢？,0,2021-10-20T05:03:16.000Z
uncleeel.grand,昨天剛下單模型😍😍,0,2021-10-19T15:47:41.000Z
h7389,多喝水讓自己好好休息,0,2021-10-19T07:52:21.000Z
chu_wan_ni,請問荷包蛋的模型哪買的？謝謝,0,2021-10-19T07:44:51.000Z
iltdanny,黑嚕嚕可愛的黑捲😄,0,2021-10-19T07:22:33.000Z
garden1799,請問照片中煎蛋的玉子燒鍋是什麼品牌的？,0,2021-10-19T06:47:21.000Z
fan.1o.11,😋😋😋,0,2021-10-19T06:17:30.000Z
eileenyu_0129,黑捲整個散發著幸福氣息❤️謝謝貝蒂讓家料理做為休息日的營養補給^^,2 ,2021-10-19T06:11:17.000Z
daypoonesnow,我也會準備料理包偶爾輕鬆煮😍😆打完要多喝水好好休息❤️,0,2021-10-19T05:55:29.000Z
alan.lina,牠整個人(哦不，是整隻狗)開心撒嬌到一個最高境界，看這態勢，牠今天應該是不打算離開我的腿了….😂😂😂黑捲太可愛了啦^^,0,2021-10-19T05:52:08.000Z
